{"aggregate_metrics":{"best_pnl_bps":0.0,"coverage":{"nonzero_notional_inputs":1,"zero_notional_inputs":0,"zero_notional_rate":0.0},"mean_pnl_bps":0.0,"mean_unrealized_pnl_usd":0.0,"median_pnl_bps":0.0,"median_unrealized_pnl_usd":0.0,"n_inputs":1,"worst_pnl_bps":0.0},"artifact_schema_version":"performance_report_artifact.v1","code_version":"93e488b02086","config_hash":"50a4430c54b0404b73d7153a9331cb8e8f94dfdb60e6d61eb1f9ef2ab13c411c","generated_at_utc":"2026-02-01T00:00:00+00:00","inputs":[{"portfolio_payload_hash":"75187f5aca12e478497947daa5d88e2fb5d9e41f5b5626dd6557e0f103376354","portfolio_run_id":"38eb02ea3f37503a9809e8e044d244ca"}],"params":{"artifacts_root":"artifacts","min_inputs_warning":2,"negative_pnl_bps_threshold":-500.0,"negative_pnl_usd_threshold":-250.0,"top1_share_threshold":0.5,"top3_share_threshold":0.8,"window_from":null,"window_to":null},"per_run_metrics":[{"concentration":{"by_category_share":{},"top1_notional_share":0.333333,"top3_notional_share":1.0},"counts":{"n_ledger":3,"n_positions":3},"exposure_by_token_side":[{"notional_usd":25.0,"quantity":48.08,"side":"BUY_YES","signed_notional_usd":25.0,"token_id":"tok-a"},{"notional_usd":25.0,"quantity":45.45,"side":"BUY_NO","signed_notional_usd":-25.0,"token_id":"tok-b"},{"notional_usd":25.0,"quantity":55.56,"side":"BUY_NO","signed_notional_usd":-25.0,"token_id":"tok-f"}],"generated_at_utc":"2026-02-01T00:00:00+00:00","n_duplicate_client_order_id_ignored":0,"pnl_bps":0.0,"portfolio_payload_hash":"75187f5aca12e478497947daa5d88e2fb5d9e41f5b5626dd6557e0f103376354","portfolio_run_id":"38eb02ea3f37503a9809e8e044d244ca","total_notional_usd":75.0,"unrealized_pnl_usd":0.0}],"performance_inputs_hash":"33b18d7f814813628411d9edd4544066bfe937de7131e12d0dabc52f255e13a5","performance_payload_hash":"c69922a68c2af51e45a7ccb264bf3c71b6e5ee69710a3821bcd2e154c008b04d","performance_policy_hash":"47cbc2e706edaee1a4e21a96139ac3627bea323013f5385fdde2aedeaa5aaf0a","performance_policy_version":"performance_report_policy.v1","quality_flags":["extreme_concentration_top3","insufficient_inputs"],"quality_warnings":[{"code":"extreme_concentration_top3","message":"Portfolio run 38eb02ea3f37503a9809e8e044d244ca top3 notional share 1.000000 exceeds threshold 0.800000."},{"code":"insufficient_inputs","message":"Performance report built with fewer than two portfolio artifacts; aggregate stability is limited."}],"run_id":"60623389e28556389848db880aa951af"}