{"aggregate_metrics":{"best_pnl_bps":0.0,"coverage":{"nonzero_notional_inputs":0,"zero_notional_inputs":1,"zero_notional_rate":1.0},"mean_pnl_bps":0.0,"mean_unrealized_pnl_usd":0.0,"median_pnl_bps":0.0,"median_unrealized_pnl_usd":0.0,"n_inputs":1,"worst_pnl_bps":0.0},"artifact_schema_version":"performance_report_artifact.v1","code_version":"93e488b02086","config_hash":"e47424f341b5a41cb1d59d3e9ebfe967c63b2b2bf1ea073bddcbc2eb8adccee2","generated_at_utc":"2026-02-16T06:22:13+00:00","inputs":[{"portfolio_payload_hash":"f617a0d5d4312ebef6e83b61f339a30b524795f3bc5397ba5b2a8b477d812b8f","portfolio_run_id":"500b1f18999652f7a341450d49242e59"}],"params":{"artifacts_root":"artifacts","min_inputs_warning":2,"negative_pnl_bps_threshold":-500.0,"negative_pnl_usd_threshold":-250.0,"top1_share_threshold":0.5,"top3_share_threshold":0.8,"window_from":null,"window_to":null},"per_run_metrics":[{"concentration":{"by_category_share":{},"top1_notional_share":0.0,"top3_notional_share":0.0},"counts":{"n_ledger":0,"n_positions":0},"exposure_by_token_side":[],"generated_at_utc":"2026-02-16T06:22:13+00:00","n_duplicate_client_order_id_ignored":0,"pnl_bps":0.0,"portfolio_payload_hash":"f617a0d5d4312ebef6e83b61f339a30b524795f3bc5397ba5b2a8b477d812b8f","portfolio_run_id":"500b1f18999652f7a341450d49242e59","total_notional_usd":0.0,"unrealized_pnl_usd":0.0}],"performance_inputs_hash":"a4e454005ccb3f078ad001288eceac16b4a45c776a89890f52a18bd379aecc1d","performance_payload_hash":"c5077cf6f42ff118e01e2a39e9219d8c3b5187493d213dd1209995996ba5a3e1","performance_policy_hash":"47cbc2e706edaee1a4e21a96139ac3627bea323013f5385fdde2aedeaa5aaf0a","performance_policy_version":"performance_report_policy.v1","quality_flags":["insufficient_inputs","zero_notional"],"quality_warnings":[{"code":"insufficient_inputs","message":"Performance report built with fewer than two portfolio artifacts; aggregate stability is limited."},{"code":"zero_notional","message":"Portfolio run 500b1f18999652f7a341450d49242e59 has zero notional exposure."}],"run_id":"f3f67f96ca07595d93904e74c30fa58f"}