{"aggregate_metrics":{"best_pnl_bps":0.0,"coverage":{"nonzero_notional_inputs":1,"zero_notional_inputs":0,"zero_notional_rate":0.0},"mean_pnl_bps":0.0,"mean_unrealized_pnl_usd":0.0,"median_pnl_bps":0.0,"median_unrealized_pnl_usd":0.0,"n_inputs":1,"worst_pnl_bps":0.0},"artifact_schema_version":"performance_report_artifact.v1","code_version":"93e488b02086","config_hash":"abc09cacad7bf96773ae0760b261b1287a97943adc5bf45738f97df00ba82ba5","generated_at_utc":"2026-02-01T00:00:00+00:00","inputs":[{"portfolio_payload_hash":"d6e662f1fe07951a772e0a8d1ab17771d2de08bd19f650724a6784c96497d790","portfolio_run_id":"bedfba2589365787b95cda410553e381"}],"params":{"artifacts_root":"artifacts","min_inputs_warning":2,"negative_pnl_bps_threshold":-500.0,"negative_pnl_usd_threshold":-250.0,"top1_share_threshold":0.5,"top3_share_threshold":0.8,"window_from":null,"window_to":null},"per_run_metrics":[{"concentration":{"by_category_share":{},"top1_notional_share":0.333333,"top3_notional_share":1.0},"counts":{"n_ledger":3,"n_positions":3},"exposure_by_token_side":[{"notional_usd":25.0,"quantity":48.08,"side":"BUY_YES","signed_notional_usd":25.0,"token_id":"tok-a"},{"notional_usd":25.0,"quantity":45.45,"side":"BUY_NO","signed_notional_usd":-25.0,"token_id":"tok-b"},{"notional_usd":25.0,"quantity":55.56,"side":"BUY_NO","signed_notional_usd":-25.0,"token_id":"tok-f"}],"generated_at_utc":"2026-02-01T00:00:00+00:00","n_duplicate_client_order_id_ignored":0,"pnl_bps":0.0,"portfolio_payload_hash":"d6e662f1fe07951a772e0a8d1ab17771d2de08bd19f650724a6784c96497d790","portfolio_run_id":"bedfba2589365787b95cda410553e381","total_notional_usd":75.0,"unrealized_pnl_usd":0.0}],"performance_inputs_hash":"6ef36eca9260d0a95ac45cfb8959e3d1c0734d1eaf8809998fa82c8d064a6f61","performance_payload_hash":"f00b3d21e06fe44ce5e5cc6bc16192bbe5cf69b1ab577335ab5ea694bf5856b1","performance_policy_hash":"47cbc2e706edaee1a4e21a96139ac3627bea323013f5385fdde2aedeaa5aaf0a","performance_policy_version":"performance_report_policy.v1","quality_flags":["extreme_concentration_top3","insufficient_inputs"],"quality_warnings":[{"code":"extreme_concentration_top3","message":"Portfolio run bedfba2589365787b95cda410553e381 top3 notional share 1.000000 exceeds threshold 0.800000."},{"code":"insufficient_inputs","message":"Performance report built with fewer than two portfolio artifacts; aggregate stability is limited."}],"run_id":"fc03420691875675acd46f490d0b1649"}