{"aggregate_metrics":{"best_pnl_bps":0.0,"coverage":{"nonzero_notional_inputs":0,"zero_notional_inputs":1,"zero_notional_rate":1.0},"mean_pnl_bps":0.0,"mean_unrealized_pnl_usd":0.0,"median_pnl_bps":0.0,"median_unrealized_pnl_usd":0.0,"n_inputs":1,"worst_pnl_bps":0.0},"artifact_schema_version":"performance_report_artifact.v1","code_version":"93e488b02086","config_hash":"300ce3b592dd9acf4749131503da7da3d5a205f0ea7bce4ce9382eff901f7322","generated_at_utc":"2026-03-10T00:00:00+00:00","inputs":[{"portfolio_payload_hash":"57a8ecac6bd1647d77308dde272092731f977f9edb845826713f1bacdcbbe803","portfolio_run_id":"6f42763de453501d9bb460ca9b008cd9"}],"params":{"artifacts_root":"artifacts","min_inputs_warning":2,"negative_pnl_bps_threshold":-500.0,"negative_pnl_usd_threshold":-250.0,"top1_share_threshold":0.5,"top3_share_threshold":0.8,"window_from":null,"window_to":null},"per_run_metrics":[{"concentration":{"by_category_share":{},"top1_notional_share":0.0,"top3_notional_share":0.0},"counts":{"n_ledger":0,"n_positions":0},"exposure_by_token_side":[],"generated_at_utc":"2026-03-10T00:00:00+00:00","n_duplicate_client_order_id_ignored":0,"pnl_bps":0.0,"portfolio_payload_hash":"57a8ecac6bd1647d77308dde272092731f977f9edb845826713f1bacdcbbe803","portfolio_run_id":"6f42763de453501d9bb460ca9b008cd9","total_notional_usd":0.0,"unrealized_pnl_usd":0.0}],"performance_inputs_hash":"623e714ec40fdd8479728025032e1599d60cde490cb9177697c5546c133cfcf8","performance_payload_hash":"0f08eaffec66839f243a2cad10a0456242c437fc585c6fd36b29ad4fc148aeb0","performance_policy_hash":"47cbc2e706edaee1a4e21a96139ac3627bea323013f5385fdde2aedeaa5aaf0a","performance_policy_version":"performance_report_policy.v1","quality_flags":["insufficient_inputs","zero_notional"],"quality_warnings":[{"code":"insufficient_inputs","message":"Performance report built with fewer than two portfolio artifacts; aggregate stability is limited."},{"code":"zero_notional","message":"Portfolio run 6f42763de453501d9bb460ca9b008cd9 has zero notional exposure."}],"run_id":"4db5a92e9ea75e07887e75355689d1ef"}