{"aggregate_metrics":{"best_pnl_bps":0.0,"coverage":{"nonzero_notional_inputs":2,"zero_notional_inputs":0,"zero_notional_rate":0.0},"mean_pnl_bps":-900.0,"mean_unrealized_pnl_usd":-90.0,"median_pnl_bps":-900.0,"median_unrealized_pnl_usd":-90.0,"n_inputs":2,"worst_pnl_bps":-1800.0},"artifact_schema_version":"performance_report_artifact.v1","code_version":"65dc0f4ceb6a","config_hash":"fa75a09d5e24eb4f1938fe64be42a071bad608af3f9491fe4aee52827e4e6947","generated_at_utc":"2026-02-04T00:00:00+00:00","inputs":[{"portfolio_payload_hash":"cdcdcdcdcdcdcdcdcdcdcdcdcdcdcdcdcdcdcdcdcdcdcdcdcdcdcdcdcdcdcdcd","portfolio_run_id":"portfolio-run-sample-a"},{"portfolio_payload_hash":"9393939393939393939393939393939393939393939393939393939393939393","portfolio_run_id":"portfolio-run-sample-b"}],"params":{"artifacts_root":"artifacts","min_inputs_warning":2,"negative_pnl_bps_threshold":-500.0,"negative_pnl_usd_threshold":-250.0,"top1_share_threshold":0.5,"top3_share_threshold":0.8,"window_from":null,"window_to":null},"per_run_metrics":[{"concentration":{"by_category_share":{"politics":0.5,"sports":0.5},"top1_notional_share":0.5,"top3_notional_share":1.0},"counts":{"n_ledger":2,"n_positions":2},"exposure_by_token_side":[{"notional_usd":100.0,"quantity":200.0,"side":"BUY_YES","signed_notional_usd":100.0,"token_id":"tok-a"},{"notional_usd":100.0,"quantity":200.0,"side":"BUY_NO","signed_notional_usd":-100.0,"token_id":"tok-b"}],"generated_at_utc":"2026-02-04T00:00:00+00:00","n_duplicate_client_order_id_ignored":0,"pnl_bps":0.0,"portfolio_payload_hash":"cdcdcdcdcdcdcdcdcdcdcdcdcdcdcdcdcdcdcdcdcdcdcdcdcdcdcdcdcdcdcdcd","portfolio_run_id":"portfolio-run-sample-a","total_notional_usd":200.0,"unrealized_pnl_usd":0.0},{"concentration":{"by_category_share":{"finance":0.1,"politics":0.9},"top1_notional_share":0.9,"top3_notional_share":1.0},"counts":{"n_ledger":3,"n_positions":3},"exposure_by_token_side":[{"notional_usd":900.0,"quantity":1000.0,"side":"BUY_YES","signed_notional_usd":900.0,"token_id":"tok-x"},{"notional_usd":50.0,"quantity":100.0,"side":"BUY_NO","signed_notional_usd":-50.0,"token_id":"tok-y"},{"notional_usd":50.0,"quantity":100.0,"side":"BUY_YES","signed_notional_usd":50.0,"token_id":"tok-z"}],"generated_at_utc":"2026-02-05T00:00:00+00:00","n_duplicate_client_order_id_ignored":2,"pnl_bps":-1800.0,"portfolio_payload_hash":"9393939393939393939393939393939393939393939393939393939393939393","portfolio_run_id":"portfolio-run-sample-b","total_notional_usd":1000.0,"unrealized_pnl_usd":-180.0}],"performance_inputs_hash":"485ce46b6685f635316e81faecc0c307893457c69822c57d20de4aa711f9bfec","performance_payload_hash":"d6569b4088d240963d0e4da3045d34f7b846caa1a5e0baf1cff5dcffaf063cf9","performance_policy_hash":"47cbc2e706edaee1a4e21a96139ac3627bea323013f5385fdde2aedeaa5aaf0a","performance_policy_version":"performance_report_policy.v1","quality_flags":["extreme_concentration_top1","extreme_concentration_top3","negative_pnl_large"],"quality_warnings":[{"code":"extreme_concentration_top1","message":"Portfolio run portfolio-run-sample-b top1 notional share 0.900000 exceeds threshold 0.500000."},{"code":"extreme_concentration_top3","message":"Portfolio run portfolio-run-sample-a top3 notional share 1.000000 exceeds threshold 0.800000."},{"code":"extreme_concentration_top3","message":"Portfolio run portfolio-run-sample-b top3 notional share 1.000000 exceeds threshold 0.800000."},{"code":"negative_pnl_large","message":"Portfolio run portfolio-run-sample-b unrealized_pnl_usd=-180.00, pnl_bps=-1800.000000 breached negative PnL threshold."}],"run_id":"db2a6ad1faf552d8baa1218e286ad240"}