{"aggregate_metrics":{"best_pnl_bps":0.0,"coverage":{"nonzero_notional_inputs":0,"zero_notional_inputs":1,"zero_notional_rate":1.0},"mean_pnl_bps":0.0,"mean_unrealized_pnl_usd":0.0,"median_pnl_bps":0.0,"median_unrealized_pnl_usd":0.0,"n_inputs":1,"worst_pnl_bps":0.0},"artifact_schema_version":"performance_report_artifact.v1","code_version":"93e488b02086","config_hash":"34d3fe662093c15ce3c9688ded7da621518fd392a38fa78ab62b251c219f3032","generated_at_utc":"2026-02-16T06:22:13+00:00","inputs":[{"portfolio_payload_hash":"35245b1fb5feb026dfdfc2e6e2946a5010f8b0d85f5e98bf49f2c2d7353f1126","portfolio_run_id":"d905a7bcd0b75ba690f585276b979bf3"}],"params":{"artifacts_root":"artifacts","min_inputs_warning":2,"negative_pnl_bps_threshold":-500.0,"negative_pnl_usd_threshold":-250.0,"top1_share_threshold":0.5,"top3_share_threshold":0.8,"window_from":null,"window_to":null},"per_run_metrics":[{"concentration":{"by_category_share":{},"top1_notional_share":0.0,"top3_notional_share":0.0},"counts":{"n_ledger":0,"n_positions":0},"exposure_by_token_side":[],"generated_at_utc":"2026-02-16T06:22:13+00:00","n_duplicate_client_order_id_ignored":0,"pnl_bps":0.0,"portfolio_payload_hash":"35245b1fb5feb026dfdfc2e6e2946a5010f8b0d85f5e98bf49f2c2d7353f1126","portfolio_run_id":"d905a7bcd0b75ba690f585276b979bf3","total_notional_usd":0.0,"unrealized_pnl_usd":0.0}],"performance_inputs_hash":"94ed39173d723faaf12967d16923a95b905a610e8907ea247caa58c9bbf5ee69","performance_payload_hash":"4ab18d4f94fc38a5b833cd215cb704f4611f0b0a6e16c0d52cad3ecdc0a93585","performance_policy_hash":"47cbc2e706edaee1a4e21a96139ac3627bea323013f5385fdde2aedeaa5aaf0a","performance_policy_version":"performance_report_policy.v1","quality_flags":["insufficient_inputs","zero_notional"],"quality_warnings":[{"code":"insufficient_inputs","message":"Performance report built with fewer than two portfolio artifacts; aggregate stability is limited."},{"code":"zero_notional","message":"Portfolio run d905a7bcd0b75ba690f585276b979bf3 has zero notional exposure."}],"run_id":"97e4b2e448e55c20a89f65f3e70df6b0"}