{"aggregate_metrics":{"best_pnl_bps":0.0,"coverage":{"nonzero_notional_inputs":1,"zero_notional_inputs":0,"zero_notional_rate":0.0},"mean_pnl_bps":0.0,"mean_unrealized_pnl_usd":0.0,"median_pnl_bps":0.0,"median_unrealized_pnl_usd":0.0,"n_inputs":1,"worst_pnl_bps":0.0},"artifact_schema_version":"performance_report_artifact.v1","code_version":"93e488b02086","config_hash":"3f3bee3c2c41488c8f8880796e7b9e3481a4237fae71b5f0ba2764a7d3b5569f","generated_at_utc":"2026-02-01T00:00:00+00:00","inputs":[{"portfolio_payload_hash":"7c48d1a2633e376bd002b22c6e412f3e006735c773d217a5a5074665df38b719","portfolio_run_id":"6ce68484b3505454998719857f47b4f2"}],"params":{"artifacts_root":"artifacts","min_inputs_warning":2,"negative_pnl_bps_threshold":-500.0,"negative_pnl_usd_threshold":-250.0,"top1_share_threshold":0.5,"top3_share_threshold":0.8,"window_from":null,"window_to":null},"per_run_metrics":[{"concentration":{"by_category_share":{},"top1_notional_share":0.333333,"top3_notional_share":1.0},"counts":{"n_ledger":3,"n_positions":3},"exposure_by_token_side":[{"notional_usd":25.0,"quantity":48.08,"side":"BUY_YES","signed_notional_usd":25.0,"token_id":"tok-a"},{"notional_usd":25.0,"quantity":45.45,"side":"BUY_NO","signed_notional_usd":-25.0,"token_id":"tok-b"},{"notional_usd":25.0,"quantity":55.56,"side":"BUY_NO","signed_notional_usd":-25.0,"token_id":"tok-f"}],"generated_at_utc":"2026-02-01T00:00:00+00:00","n_duplicate_client_order_id_ignored":0,"pnl_bps":0.0,"portfolio_payload_hash":"7c48d1a2633e376bd002b22c6e412f3e006735c773d217a5a5074665df38b719","portfolio_run_id":"6ce68484b3505454998719857f47b4f2","total_notional_usd":75.0,"unrealized_pnl_usd":0.0}],"performance_inputs_hash":"abb8ce27fb0f34212fe95d9bdb6d64606ff8f26a0e7a9956ee6113bedd293648","performance_payload_hash":"8947461dee218a996a919f0454f2d93392338e541633ba6f5cb4f63ed8ac8a3b","performance_policy_hash":"47cbc2e706edaee1a4e21a96139ac3627bea323013f5385fdde2aedeaa5aaf0a","performance_policy_version":"performance_report_policy.v1","quality_flags":["extreme_concentration_top3","insufficient_inputs"],"quality_warnings":[{"code":"extreme_concentration_top3","message":"Portfolio run 6ce68484b3505454998719857f47b4f2 top3 notional share 1.000000 exceeds threshold 0.800000."},{"code":"insufficient_inputs","message":"Performance report built with fewer than two portfolio artifacts; aggregate stability is limited."}],"run_id":"c6662c9576ac5bf49c57eee28c34c40c"}