{"aggregate_metrics":{"best_pnl_bps":0.0,"coverage":{"nonzero_notional_inputs":0,"zero_notional_inputs":1,"zero_notional_rate":1.0},"mean_pnl_bps":0.0,"mean_unrealized_pnl_usd":0.0,"median_pnl_bps":0.0,"median_unrealized_pnl_usd":0.0,"n_inputs":1,"worst_pnl_bps":0.0},"artifact_schema_version":"performance_report_artifact.v1","code_version":"93e488b02086","config_hash":"412d80c2be55df955ff97874d19ab39a5efa3a6f4323763fc213aa5a6e487126","generated_at_utc":"2026-02-16T06:22:13+00:00","inputs":[{"portfolio_payload_hash":"da4c05cb127113de6fef2c531212a1f8aaac911c366d539642d0ce67348203be","portfolio_run_id":"549b6723f82657efa8528050551c2671"}],"params":{"artifacts_root":"artifacts","min_inputs_warning":2,"negative_pnl_bps_threshold":-500.0,"negative_pnl_usd_threshold":-250.0,"top1_share_threshold":0.5,"top3_share_threshold":0.8,"window_from":null,"window_to":null},"per_run_metrics":[{"concentration":{"by_category_share":{},"top1_notional_share":0.0,"top3_notional_share":0.0},"counts":{"n_ledger":0,"n_positions":0},"exposure_by_token_side":[],"generated_at_utc":"2026-02-16T06:22:13+00:00","n_duplicate_client_order_id_ignored":0,"pnl_bps":0.0,"portfolio_payload_hash":"da4c05cb127113de6fef2c531212a1f8aaac911c366d539642d0ce67348203be","portfolio_run_id":"549b6723f82657efa8528050551c2671","total_notional_usd":0.0,"unrealized_pnl_usd":0.0}],"performance_inputs_hash":"96c7a81e1d028afc7b9b347c7cd0cebd6de3c7dd8f995bcee84fc4e7fd84d595","performance_payload_hash":"b4a87652ad88bbd49f579768569376db5694a2c367c568e16a623dea1d57bb27","performance_policy_hash":"47cbc2e706edaee1a4e21a96139ac3627bea323013f5385fdde2aedeaa5aaf0a","performance_policy_version":"performance_report_policy.v1","quality_flags":["insufficient_inputs","zero_notional"],"quality_warnings":[{"code":"insufficient_inputs","message":"Performance report built with fewer than two portfolio artifacts; aggregate stability is limited."},{"code":"zero_notional","message":"Portfolio run 549b6723f82657efa8528050551c2671 has zero notional exposure."}],"run_id":"678bc6ddecd15b0a811360750dce928e"}